{"baseImage":{"architecture":"amd64","configDigest":"sha256:db825c749364f7f06c8fb165b360d9de94ba5c14727e2e446c1b4202a30224e7","indexDigest":"sha256:fd76ade0c607f27677bc04be3c60749f400eedc941d9e72967e19a4cedff80c2","os":"linux","platformDigest":"sha256:8c97ebedc32fd60935cdf5992e935753e2a0f98231830028050e1e04bd3c13c2","reference":"docker.io/library/python@sha256:fd76ade0c607f27677bc04be3c60749f400eedc941d9e72967e19a4cedff80c2","variant":null},"legalInventorySha256":"1160a604f6c6997f939bd212b15488d05e10d8562ca60c6757a9d96409a6d128","models":[{"archiveType":"tar","bytes":4935680,"licenseExpression":"Apache-2.0","licenseSha256":"4cc20ad6d41af86b3ce9885ffb0956e152574a2eb14179aeb07fd2d3956161ca","licenseSourcePath":"legal/models/PP-OCRv5_mobile_det.MODEL_CARD.md","mediaType":"application/x-tar","modelId":"PP-OCRv5_mobile_det","modelRevision":"ffb64904d23708863ff5b8da312a5cbd52a7f462","noticePath":"legal/models/PP-OCRv5_mobile_det.NOTICE.txt","noticeSha256":"638a54c6cfb0fc69f7a7aca2d375b35f6f39b6b99a6988a34abd2891751f2531","role":"detector","sha256":"50446e5d01ac2a73d5319c89513281f6578414c888c602f9af13f93feefffc58","sourceId":"paddlex","treeSha256":"9263307ff8b2863cc3764f63e16d4d5317ec7d0012627382d41a67411af5844a","url":"https://paddle-model-ecology.bj.bcebos.com/paddlex/official_inference_model/paddle3.0.0/PP-OCRv5_mobile_det_infer.tar"},{"archiveType":"tar","bytes":16834560,"licenseExpression":"Apache-2.0","licenseSha256":"b02727443cef4904a9ee12accdfaf66fcbada7b93a1a05c40dde7582291ba28c","licenseSourcePath":"legal/models/PP-OCRv5_mobile_rec.MODEL_CARD.md","mediaType":"application/x-tar","modelId":"PP-OCRv5_mobile_rec","modelRevision":"ffb64904d23708863ff5b8da312a5cbd52a7f462","noticePath":"legal/models/PP-OCRv5_mobile_rec.NOTICE.txt","noticeSha256":"fcb2ceaf16590e0029a443a4daf698257d7978b05d7e3948c334608157268ac1","role":"recognizer","sha256":"566b9512b34e34a9f0db54d87b51fa5a0b9ed2cf1ab7e49728cc0b8b5a64f414","sourceId":"paddlex","treeSha256":"76ad80b3557fc2a145ea5c2e65746d387860498eed93f337f2b675477a7d185c","url":"https://paddle-model-ecology.bj.bcebos.com/paddlex/official_inference_model/paddle3.0.0/PP-OCRv5_mobile_rec_infer.tar"}],"packages":[{"bytes":15038,"filename":"aiohappyeyeballs-2.7.1-py3-none-any.whl","id":"aiohappyeyeballs-wheel","mediaType":"application/zip","name":"aiohappyeyeballs","sha256":"9243213661e29250eb41368e5daa826fc017156c3b8a11440826b2e3ed376472","url":"https://files.pythonhosted.org/packages/71/43/1947f06babed6b3f1d7f38b0c767f52df66bfb2bc10b468c4a7de9eceff2/aiohappyeyeballs-2.7.1-py3-none-any.whl","version":"2.7.1","wheelTags":["py3-none-any"]},{"bytes":1714075,"filename":"aiohttp-3.14.3-cp310-cp310-manylinux2014_x86_64.manylinux_2_17_x86_64.manylinux_2_28_x86_64.whl","id":"aiohttp-wheel","mediaType":"application/zip","name":"aiohttp","sha256":"48d67b87db6279c044760787eb01f6413032c2e6f3ba1cafaa492b1c8e578479","url":"https://files.pythonhosted.org/packages/bd/ff/cb36724e8c8d17f90ada567a9ff3efe1d6e9b549fba697a242aece180f21/aiohttp-3.14.3-cp310-cp310-manylinux2014_x86_64.manylinux_2_17_x86_64.manylinux_2_28_x86_64.whl","version":"3.14.3","wheelTags":["cp310-cp310-manylinux2014_x86_64.manylinux_2_17_x86_64.manylinux_2_28_x86_64"]},{"bytes":7490,"filename":"aiosignal-1.4.0-py3-none-any.whl","id":"aiosignal-wheel","mediaType":"application/zip","name":"aiosignal","sha256":"053243f8b92b990551949e63930a839ff0cf0b0ebbe0597b0f3fb19e1a0fe82e","url":"https://files.pythonhosted.org/packages/fb/76/641ae371508676492379f16e2fa48f4e2c11741bd63c48be4b12a6b09cba/aiosignal-1.4.0-py3-none-any.whl","version":"1.4.0","wheelTags":["py3-none-any"]},{"bytes":67186,"filename":"aistudio_sdk-0.3.9-py3-none-any.whl","id":"aistudio-sdk-wheel","mediaType":"application/zip","name":"aistudio_sdk","sha256":"41621d052ddb7a58643438a7ca541f58ef0ab94a2acdfff0a71db81bf68dc027","url":"https://files.pythonhosted.org/packages/c2/56/ce14f76c1892f335fbcd82568d347fd1652e1a4b0b76ac4a4cd90e1ae202/aistudio_sdk-0.3.9-py3-none-any.whl","version":"0.3.9","wheelTags":["py3-none-any"]},{"bytes":13427,"filename":"annotated_types-0.8.0-py3-none-any.whl","id":"annotated-types-wheel","mediaType":"application/zip","name":"annotated-types","sha256":"f072f4d804ea359e4eaf198b1af7a8b0943881a87f31bb764f8bf219bb9419e0","url":"https://files.pythonhosted.org/packages/99/91/8acff4f5e50511b911bbccb72b8628a49c68ce14148cd9f6431094859a90/annotated_types-0.8.0-py3-none-any.whl","version":"0.8.0","wheelTags":["py3-none-any"]},{"bytes":125813,"filename":"anyio-4.14.2-py3-none-any.whl","id":"anyio-wheel","mediaType":"application/zip","name":"anyio","sha256":"9f505dda5ac9f0c8309b5e8bd445a8c2bf7246f3ce950121e45ea15bc41d1494","url":"https://files.pythonhosted.org/packages/da/35/f2287558c17e29fafc8ef3daf819bb9834061cfa43bff8014f7df7f63bdc/anyio-4.14.2-py3-none-any.whl","version":"4.14.2","wheelTags":["py3-none-any"]},{"bytes":6233,"filename":"async_timeout-5.0.1-py3-none-any.whl","id":"async-timeout-wheel","mediaType":"application/zip","name":"async-timeout","sha256":"39e3809566ff85354557ec2398b55e096c8364bacac9405a7a1fa429e77fe76c","url":"https://files.pythonhosted.org/packages/fe/ba/e2081de779ca30d473f21f5b30e0e737c438205440784c7dfc81efc2b029/async_timeout-5.0.1-py3-none-any.whl","version":"5.0.1","wheelTags":["py3-none-any"]},{"bytes":67548,"filename":"attrs-26.1.0-py3-none-any.whl","id":"attrs-wheel","mediaType":"application/zip","name":"attrs","sha256":"c647aa4a12dfbad9333ca4e71fe62ddc36f4e63b2d260a37a8b83d2f043ac309","url":"https://files.pythonhosted.org/packages/64/b4/17d4b0b2a2dc85a6df63d1157e028ed19f90d4cd97c36717afef2bc2f395/attrs-26.1.0-py3-none-any.whl","version":"26.1.0","wheelTags":["py3-none-any"]},{"bytes":435179,"filename":"bce_python_sdk-0.9.76-py3-none-any.whl","id":"bce-python-sdk-wheel","mediaType":"application/zip","name":"bce-python-sdk","sha256":"e629181d060f4ed8f29749f47139bf08f1f9b0d8b15daedc956900785587e8d8","url":"https://files.pythonhosted.org/packages/b9/06/4d4a26c3dfcdb29599f563329b87eefe55b02b3c2b9d8f8c3aeaa38a33a6/bce_python_sdk-0.9.76-py3-none-any.whl","version":"0.9.76","wheelTags":["py3-none-any"]},{"bytes":136983,"filename":"certifi-2026.7.22-py3-none-any.whl","id":"certifi-wheel","mediaType":"application/zip","name":"certifi","sha256":"62f22742b58a1a33014a2b6b706588a8d7e2a88ae7bd1a6ebe8c992928483775","url":"https://files.pythonhosted.org/packages/0b/a7/71ac2cff56fec219ed242bb11b8efb69fcc4bec75db06fb7bfe35de520e6/certifi-2026.7.22-py3-none-any.whl","version":"2026.7.22","wheelTags":["py3-none-any"]},{"bytes":1484628,"filename":"chardet-7.6.0-cp310-cp310-manylinux2014_x86_64.manylinux_2_17_x86_64.manylinux_2_28_x86_64.whl","id":"chardet-wheel","mediaType":"application/zip","name":"chardet","sha256":"4b81d3f7d7914442d5f7d515b8c6d79cee6b794bc208971fb6902f176671166a","url":"https://files.pythonhosted.org/packages/f2/34/0fd9d566df9647d0820a35b4d119db971da3ae9be20899d2b4af11d7ab58/chardet-7.6.0-cp310-cp310-manylinux2014_x86_64.manylinux_2_17_x86_64.manylinux_2_28_x86_64.whl","version":"7.6.0","wheelTags":["cp310-cp310-manylinux2014_x86_64.manylinux_2_17_x86_64.manylinux_2_28_x86_64"]},{"bytes":261644,"filename":"charset_normalizer-3.5.1-cp310-cp310-manylinux2014_x86_64.manylinux_2_17_x86_64.manylinux_2_28_x86_64.whl","id":"charset-normalizer-wheel","mediaType":"application/zip","name":"charset-normalizer","sha256":"96eefc178f8636b9c760c5829345307fd81cfae9ab1e80997dbddeb0f54ee9a3","url":"https://files.pythonhosted.org/packages/32/cd/4f564b8f132de25db594efc706897069f016790cea63a5669c9df2675f64/charset_normalizer-3.5.1-cp310-cp310-manylinux2014_x86_64.manylinux_2_17_x86_64.manylinux_2_28_x86_64.whl","version":"3.5.1","wheelTags":["cp310-cp310-manylinux2014_x86_64.manylinux_2_17_x86_64.manylinux_2_28_x86_64"]},{"bytes":125251,"filename":"click-8.5.0-py3-none-any.whl","id":"click-wheel","mediaType":"application/zip","name":"click","sha256":"255bc9599cf7748b4b1a446ccc735421bd08a2ae529a8b88597d3de5664ee360","url":"https://files.pythonhosted.org/packages/58/50/6c0d534c5f134586a8e1ba4e330569e32f057e33372ae556463212fb4cd3/click-8.5.0-py3-none-any.whl","version":"8.5.0","wheelTags":["py3-none-any"]},{"bytes":12239,"filename":"colorlog-6.12.0-py3-none-any.whl","id":"colorlog-wheel","mediaType":"application/zip","name":"colorlog","sha256":"30d392604e9110045a2c2aeefc27d7a017abbab63f3a8aee594eac0801df784e","url":"https://files.pythonhosted.org/packages/d4/19/0b6647bf5e331521e55d2b63bfbdc210bd9cd605189273f03614a05f702d/colorlog-6.12.0-py3-none-any.whl","version":"6.12.0","wheelTags":["py3-none-any"]},{"bytes":79426,"filename":"crc32c-2.9-cp310-cp310-manylinux1_x86_64.manylinux_2_28_x86_64.manylinux_2_5_x86_64.whl","id":"crc32c-wheel","mediaType":"application/zip","name":"crc32c","sha256":"1399d598259cb25596adebe2a9f6fd928ad58089337f6cb0d5f53c8b4b481b8d","url":"https://files.pythonhosted.org/packages/52/80/fcf56f17c0468735761b8bde8b8b64f667f3747c0c40670756e9d51b610d/crc32c-2.9-cp310-cp310-manylinux1_x86_64.manylinux_2_28_x86_64.manylinux_2_5_x86_64.whl","version":"2.9","wheelTags":["cp310-cp310-manylinux1_x86_64.manylinux_2_28_x86_64.manylinux_2_5_x86_64"]},{"bytes":16740,"filename":"exceptiongroup-1.3.1-py3-none-any.whl","id":"exceptiongroup-wheel","mediaType":"application/zip","name":"exceptiongroup","sha256":"a7a39a3bd276781e98394987d3a5701d0c4edffb633bb7a5144577f82c773598","url":"https://files.pythonhosted.org/packages/8a/0e/97c33bf5009bdbac74fd2beace167cab3f978feb69cc36f1ef79360d6c4e/exceptiongroup-1.3.1-py3-none-any.whl","version":"1.3.1","wheelTags":["py3-none-any"]},{"bytes":95514,"filename":"fastapi-0.115.14-py3-none-any.whl","id":"fastapi-wheel","mediaType":"application/zip","name":"fastapi","sha256":"6c0c8bf9420bd58f565e585036d971872472b4f7d3f6c73b698e10cffdefb3ca","url":"https://files.pythonhosted.org/packages/53/50/b1222562c6d270fea83e9c9075b8e8600b8479150a18e4516a6138b980d1/fastapi-0.115.14-py3-none-any.whl","version":"0.115.14","wheelTags":["py3-none-any"]},{"bytes":99864,"filename":"filelock-3.32.4-py3-none-any.whl","id":"filelock-wheel","m